<?xml version="1.0" encoding="UTF-8"?>
<catalogo xmlns:xsi="http://www.w3.org/2001/XMLSchema-instance" xsi:noNamespaceSchemaLocation="../schema/schemaCatalogoProdotti.xsd"><prodotto id="1" id_categoria="1" id_tipo="1"><nome>Apple Macbook Air</nome><prezzo_listino>400</prezzo_listino><percorso_immagine>../img/immagini_prodotti/macbook.jpg</percorso_immagine><specifiche>Dimensioni diagonale schermo: 14.2  &#13;
Modello del processore: M3 Pro  &#13;
RAM installata: 18 GB &#13;
Capacit√† SSD: 512 GB &#13;
Sistema operativo incluso: macOS Sonoma  &#13;
Scheda grafica dedicata: Non disponibile &#13; Risoluzione del display: 3024 x 1964 pixel &#13;
Touch screen: No</specifiche><descrizione>Portatile molto costoso della Apple</descrizione><offerta_speciale percentuale="10" crediti="2">
    <data_inizio>2024-06-01</data_inizio>
    <data_fine>2024-12-30</data_fine>
</offerta_speciale></prodotto></catalogo>
